description,original_price,discount,reviews,ratings,sale,soldout,product_price
LadyLuck Curvy U' Seamless Full Bodysuit - Black,,,No reviews,0.00,,Available,"KSh6,900.00"
LadyLuck SuperComfort Everyday Bra - Black,,,No reviews,0.00,,Available,"KSh4,450.00"
LadyLuck Curvy U' Seamless Full Bodysuit - Chocolate,,,No reviews,0.00,,Available,"KSh6,900.00"
LadyLuck SuperComfort Everyday Bra - Maroon,,,No reviews,0.00,,Available,"KSh4,450.00"
LadyLuck Curvy U' Seamless Shorts - Chocolate,,,No reviews,0.00,,Available,"KSh6,900.00"
LadyLuck Curvy U' Seamless Shorts - Black,,,No reviews,0.00,,Available,"KSh6,900.00"
LadyLuck Cupid Bodysuit - Burgandy,,,No reviews,0.00,,Available,"KSh5,900.00"
LadyLuck Super Comfy Nursing Bras - Army Green,,,No reviews,0.00,,Available,"KSh3,400.00"
LadyLuck Blossom Bra - Gray,,,No reviews,0.00,,Available,"KSh4,900.00"
LadyLuck Go Strapless Bra - Brown,,,No reviews,0.00,,Available,"KSh3,900.00"
LadyLuck Alluring Bodysuit - Plum Red,,,No reviews,0.00,,Available,"KSh3,900.00"
LadyLuck Super Comfy Nursing Bras - Mauve Pink,,,No reviews,0.00,,Available,"KSh3,400.00"
LadyLuck Booty Booster & Waist Control - Black,,,No reviews,0.00,,Available,"KSh5,200.00"
LadyLuck Go Strapless Bra - Black,,,No reviews,0.00,,Available,"KSh3,900.00"
LadyLuck Super Comfy Nursing Bras - Ash Gray,,,No reviews,0.00,,Available,"KSh3,400.00"
LadyLuck Bloom Babydoll - Floral,,,No reviews,0.00,,Available,"KSh4,900.00"
LadyLuck Go Strapless Plus Size Bra - Black,,,No reviews,0.00,,Available,"KSh4,500.00"
LadyLuck Blossom Bra - Floral,,,No reviews,0.00,,Available,"KSh4,900.00"
LadyLuck Berry Red Bra Set - Berry Red,,,No reviews,0.00,,Available,"KSh4,900.00"
LadyLuck Bubbles Bodysuit - White,,,No reviews,0.00,,Available,"KSh3,900.00"
LadyLuck Instant Curves Shaping Panty - Beige,,,No reviews,0.00,,Available,"KSh3,700.00"
LadyLuck Couture Moulding Shorts - Blush,,,No reviews,0.00,,Available,"KSh8,600.00"
LadyLuck Low Plunge Bra - Purple,,,No reviews,0.00,,Available,"KSh3,900.00"
LadyLuck Desire Bodysuit - Black,,,No reviews,0.00,,Available,"KSh6,500.00"
LadyLuck Hourglass Waspie Tight Lace Corset - Black,,,No reviews,0.00,,Available,"KSh13,900.00"
LadyLuck Tummy Trimmer Corset - Floral,,,No reviews,0.00,,Available,"KSh6,900.00"
LadyLuck Thigh High Moulding Shorts - Black,,,No reviews,0.00,,Available,"KSh6,900.00"
LadyLuck Couture Moulding Shorts - Black,,,No reviews,0.00,,Available,"KSh8,600.00"
LadyLuck Black Strapless Bra - Black,,,No reviews,0.00,,Available,"KSh3,900.00"
LadyLuck Sassy Bodysuit - Pearl White,,,No reviews,0.00,,Available,"KSh6,500.00"
LadyLuck Ebony Garden Braset - Black Floral,,,No reviews,0.00,,Available,"KSh6,600.00"
LadyLuck Berry Brallet Set - Berry,,,No reviews,0.00,,Available,"KSh4,900.00"
LadyLuck Shades of Gray Braset - Gray,,,No reviews,0.00,,Available,"KSh6,600.00"
LadyLuck Low Plunge Bra - Black,,,1 review,5.00,,Available,"KSh3,900.00"
LadyLuck Instant Curves Shaping Panty - Black,,,No reviews,0.00,,Available,"KSh3,700.00"
LadyLuck Sleek Full Bodysuits - Black,,,No reviews,0.00,,Available,"KSh6,300.00"
LadyLuck Lux Satin Bra - Green,,,No reviews,0.00,,Available,"KSh3,900.00"
LadyLuck Cupid Bodysuit - White,,,No reviews,0.00,,Available,"KSh5,900.00"
LadyLuck Turquoise Braset - Turquoise,,,No reviews,0.00,,Available,"KSh6,600.00"
LadyLuck Cupid Slip - Burgandy,,,No reviews,0.00,,Available,"KSh5,900.00"
LadyLuck Cupid Full Bodysuit - White,,,No reviews,0.00,,Available,"KSh5,900.00"
LadyLuck Sassy Bodysuit - Envy Green,,,No reviews,0.00,,Available,"KSh6,500.00"
LadyLuck Invisible Moulding Shorts - Black,,,1 review,5.00,,Available,"KSh4,900.00"
LadyLuck Instant Curves Body Suit - Black,,,No reviews,0.00,,Available,"KSh6,900.00"
LadyLuck Snapback Corset - Black,,,No reviews,0.00,,Available,"KSh7,900.00"
LadyLuck Instant Curves Tight Lace Corset - Black,,,No reviews,0.00,,Available,"KSh15,900.00"
LadyLuck Lux Satin Bra - Purple,,,No reviews,0.00,,Available,"KSh3,900.00"
LadyLuck Cupid Slip - White,,,No reviews,0.00,,Available,"KSh5,900.00"
LadyLuck Cupid Full Bodysuit - Beige,,,No reviews,0.00,,Available,"KSh5,900.00"
LadyLuck Hourglass Mesh Tight Lace Corsets - Black,,,No reviews,0.00,,Available,"KSh13,900.00"
LadyLuck Sleek Full Bodysuits - Beige,,,No reviews,0.00,,Available,"KSh6,300.00"
LadyLuck Mid Thigh Moulding Shorts (Long) - Black,,,No reviews,0.00,,Available,"KSh6,900.00"
Lola Satin Bralette With Ruche Back  - White,"KSh1,400.00",30,No reviews,0.00,,Sold out,"KSh1,400.00"
Lola Satin Bralette With Back Hooks - White,"KSh1,400.00",30,No reviews,0.00,,Sold out,"KSh1,400.00"
Intimates Kenya-Black Elegant Feather Garter Bra Set & Fishnets,"KSh5,000.00",30,No reviews,0.00,Sale,Available,"KSh5,000.00"
Intimates Kenya-Chic Kissable Black Sheer Mesh Backless Bodysuit With Underwire and Fishnets - Black,"KSh5,000.00",30,No reviews,0.00,Sale,Available,"KSh5,000.00"
Intimates Kenya-Red Exquisite Lace Open Cup Bodysuit - Red,"KSh5,000.00",40,No reviews,0.00,Sale,Available,"KSh5,000.00"
Intimates Kenya-Sexy Lingerie Furry Temptation Passion perspective Bodysuit - Black,"KSh5,000.00",40,No reviews,0.00,Sale,Available,"KSh5,000.00"
Intimates Kenya Surrender Set - Black,,,1 review,4.00,,Available,"KSh2,500.00"
Intimate Kenya 3 Piece Set - Maroon,,,No reviews,0.00,,Available,"KSh2,800.00"
